{
  "id": "9f4d2e0c-7b3a-4d11-89c4-1d2f3a9b5c6d",
  "displayName": "Design Milestone \u2014 60% Submittal",
  "name": "60-percent-submittal",
  "description": "60% design submittal package frozen for owner review.",
  "changesetId": "ABC123abc456def789",
  "changesetIndex": 12,
  "createdDateTime": "2026-03-05T09:00:00Z",
  "state": "visible"
}